{
  "$schema": "https://json-schema.org/draft/2020-12/schema",
  "additionalProperties": true,
  "properties": {
    "artifact_id": {
      "const": "V0_OSAP_GATE3_CLUSTER_B_WP2_POST_MERGE_CLOSEOUT_GATES"
    },
    "date": {
      "const": "2026-07-22"
    },
    "gate_count": {
      "const": 18
    },
    "gates": {
      "maxItems": 18,
      "minItems": 18,
      "type": "array"
    },
    "release_actions_authorized": {
      "const": false
    },
    "status": {
      "const": "PASS"
    },
    "version": {
      "const": "0.1"
    }
  },
  "required": [
    "artifact_id",
    "date",
    "gate_count",
    "gates",
    "status",
    "version"
  ],
  "type": "object"
}
